{
  "profile_version": "1.0",
  "project_id": "jipbap",
  "content_family": "OBSERVATION_SENSORY",
  "creative_authority_root": "jipbap",
  "creative_authority_refs": [
    "CURRENT_STATE.md",
    "JIPBAP_V1_SPEC.md"
  ],
  "episode_id_pattern": "^[0-9]{3,}$",
  "products": [
    {
      "id": "carousel",
      "kind": "CAROUSEL",
      "status": "ACTIVE",
      "aspect_ratio": "4:5",
      "delivery": "SEPARATE_FRAME_FILES",
      "cover_mode": "SEPARATE_REQUIRED",
      "product_order": [
        "COVER",
        "BODY"
      ],
      "allow_external_cover_import": true
    },
    {
      "id": "vertical_motion",
      "kind": "VERTICAL_MOTION",
      "status": "PLANNED",
      "aspect_ratio": "9:16",
      "delivery": "VIDEO_FILE"
    }
  ],
  "stage_overrides": {
    "WORK_RESEARCH": {
      "intent": "Study complete food-comic works only to improve appetite, rhythm, restraint and readable six-panel pacing. Do not promote observations into hard gates without repeated evidence.",
      "authority_refs": [
        "JIPBAP_V1_SPEC.md"
      ]
    },
    "RADAR": {
      "intent": "Choose a concrete menu/moment capable of sustaining six publishable sensory beats without procedural filler.",
      "authority_refs": [
        "JIPBAP_V1_SPEC.md"
      ]
    },
    "EDITORIAL": {
      "intent": "Define the PROXY_EATER appetite arc and map exactly six publishable beats. Slot roles remain story-dependent.",
      "authority_refs": [
        "JIPBAP_V1_SPEC.md"
      ]
    },
    "STORYBOARD": {
      "intent": "Plan one six-cell board with minimal food-state/action continuity while leaving camera, pose, expression and per-cell composition fluid.",
      "authority_refs": [
        "JIPBAP_V1_SPEC.md"
      ]
    },
    "ASSET_PRODUCTION": {
      "intent": "Compatibility stage name only: for JIPBAP_V1 this means generate the single text-free six-panel master board with bound style references. It does not mean asset resolution, ASSET_GAP authoring, or deterministic PERSON/FOOD part composition.",
      "authority_refs": [
        "CURRENT_STATE.md",
        "JIPBAP_V1_SPEC.md"
      ]
    },
    "COMPOSITION": {
      "intent": "Deterministically extract the accepted board, fit six 4:5 BODY pages, assemble the separate cover, and apply editable lettering/inner-thought layers. Do not regenerate accepted art for layout-only defects.",
      "authority_refs": [
        "JIPBAP_V1_SPEC.md"
      ]
    },
    "QC": {
      "intent": "Apply only the JIPBAP_V1 publish-blocking hard fails to the master board; treat non-blocking polish issues as soft score. Review the completed carousel once before export.",
      "authority_refs": [
        "JIPBAP_V1_SPEC.md"
      ]
    }
  }
}
